{
  "contract_version": "1.0",
  "demonstration_id": "demo_merrill_2026q2_synthetic",
  "tenant_id": "bank_pilot",
  "growth_play_id": "merrill-relationship-growth",
  "business_line": "wealth-management",
  "evidence_class": "synthetic",
  "captured_at": "2026-05-02T00:00:00.000Z",
  "window": {
    "from": "2026-04-01T00:00:00.000Z",
    "to": "2026-04-30T23:59:59.000Z"
  },
  "expert_selection": {
    "basis": "Top-decile advisors by net new assets in the trailing four quarters, within one Merrill growth desk.",
    "expert_count": 2,
    "source_system": "cew_book_360"
  },
  "cases": [
    {
      "household_token": "tok_demo_merrill_0001",
      "exposed": true,
      "records": [
        {
          "transaction_id": "tx_acats_1",
          "source_system": "merrill_transfer_workflow",
          "rail": "acats",
          "amount": 25000,
          "occurred_at": "2026-04-12T14:05:00.000Z"
        },
        {
          "transaction_id": "tx_book_1",
          "source_system": "merrill_books",
          "rail": "account",
          "amount": 0,
          "occurred_at": "2026-04-02T09:00:00.000Z"
        },
        {
          "transaction_id": "tx_digital_1",
          "source_system": "merrill_digital",
          "rail": "digital",
          "amount": 3,
          "occurred_at": "2026-04-20T18:30:00.000Z"
        }
      ],
      "policies": [
        {
          "policy_id": "consent",
          "verdict": "clear"
        },
        {
          "policy_id": "eligibility",
          "verdict": "clear"
        },
        {
          "policy_id": "vulnerability",
          "verdict": "clear"
        }
      ]
    },
    {
      "household_token": "tok_demo_merrill_0002",
      "exposed": true,
      "records": [
        {
          "transaction_id": "tx_acats_2",
          "source_system": "merrill_transfer_workflow",
          "rail": "acats",
          "amount": 50000,
          "occurred_at": "2026-04-12T14:05:00.000Z"
        },
        {
          "transaction_id": "tx_book_2",
          "source_system": "merrill_books",
          "rail": "account",
          "amount": 0,
          "occurred_at": "2026-04-02T09:00:00.000Z"
        },
        {
          "transaction_id": "tx_digital_2",
          "source_system": "merrill_digital",
          "rail": "digital",
          "amount": 3,
          "occurred_at": "2026-04-20T18:30:00.000Z"
        }
      ],
      "policies": [
        {
          "policy_id": "consent",
          "verdict": "clear"
        },
        {
          "policy_id": "eligibility",
          "verdict": "clear"
        },
        {
          "policy_id": "vulnerability",
          "verdict": "clear"
        }
      ]
    },
    {
      "household_token": "tok_demo_merrill_0003",
      "exposed": false,
      "records": [
        {
          "transaction_id": "tx_acats_3",
          "source_system": "merrill_transfer_workflow",
          "rail": "acats",
          "amount": 75000,
          "occurred_at": "2026-04-12T14:05:00.000Z"
        },
        {
          "transaction_id": "tx_book_3",
          "source_system": "merrill_books",
          "rail": "account",
          "amount": 0,
          "occurred_at": "2026-04-02T09:00:00.000Z"
        },
        {
          "transaction_id": "tx_digital_3",
          "source_system": "merrill_digital",
          "rail": "digital",
          "amount": 3,
          "occurred_at": "2026-04-20T18:30:00.000Z"
        }
      ],
      "policies": [
        {
          "policy_id": "consent",
          "verdict": "clear"
        },
        {
          "policy_id": "eligibility",
          "verdict": "clear"
        },
        {
          "policy_id": "vulnerability",
          "verdict": "clear"
        }
      ]
    },
    {
      "household_token": "tok_demo_merrill_0004",
      "exposed": true,
      "records": [
        {
          "transaction_id": "tx_acats_4",
          "source_system": "merrill_transfer_workflow",
          "rail": "acats",
          "amount": 100000,
          "occurred_at": "2026-04-12T14:05:00.000Z"
        },
        {
          "transaction_id": "tx_book_4",
          "source_system": "merrill_books",
          "rail": "account",
          "amount": 0,
          "occurred_at": "2026-04-02T09:00:00.000Z"
        },
        {
          "transaction_id": "tx_digital_4",
          "source_system": "merrill_digital",
          "rail": "digital",
          "amount": 3,
          "occurred_at": "2026-04-20T18:30:00.000Z"
        }
      ],
      "policies": [
        {
          "policy_id": "consent",
          "verdict": "clear"
        },
        {
          "policy_id": "eligibility",
          "verdict": "clear"
        },
        {
          "policy_id": "vulnerability",
          "verdict": "clear"
        }
      ]
    },
    {
      "household_token": "tok_demo_merrill_0005",
      "exposed": true,
      "records": [
        {
          "transaction_id": "tx_acats_5",
          "source_system": "merrill_transfer_workflow",
          "rail": "acats",
          "amount": 125000,
          "occurred_at": "2026-04-12T14:05:00.000Z"
        },
        {
          "transaction_id": "tx_book_5",
          "source_system": "merrill_books",
          "rail": "account",
          "amount": 0,
          "occurred_at": "2026-04-02T09:00:00.000Z"
        },
        {
          "transaction_id": "tx_digital_5",
          "source_system": "merrill_digital",
          "rail": "digital",
          "amount": 3,
          "occurred_at": "2026-04-20T18:30:00.000Z"
        }
      ],
      "policies": [
        {
          "policy_id": "consent",
          "verdict": "clear"
        },
        {
          "policy_id": "eligibility",
          "verdict": "clear"
        },
        {
          "policy_id": "vulnerability",
          "verdict": "clear"
        }
      ]
    },
    {
      "household_token": "tok_demo_merrill_0006",
      "exposed": true,
      "records": [
        {
          "transaction_id": "tx_acats_6",
          "source_system": "merrill_transfer_workflow",
          "rail": "acats",
          "amount": 150000,
          "occurred_at": "2026-04-12T14:05:00.000Z"
        },
        {
          "transaction_id": "tx_book_6",
          "source_system": "merrill_books",
          "rail": "account",
          "amount": 0,
          "occurred_at": "2026-04-02T09:00:00.000Z"
        },
        {
          "transaction_id": "tx_digital_6",
          "source_system": "merrill_digital",
          "rail": "digital",
          "amount": 3,
          "occurred_at": "2026-04-20T18:30:00.000Z"
        }
      ],
      "policies": [
        {
          "policy_id": "consent",
          "verdict": "clear"
        },
        {
          "policy_id": "eligibility",
          "verdict": "clear"
        },
        {
          "policy_id": "vulnerability",
          "verdict": "clear"
        }
      ]
    },
    {
      "household_token": "tok_demo_merrill_0007",
      "exposed": true,
      "records": [
        {
          "transaction_id": "tx_acats_7",
          "source_system": "merrill_transfer_workflow",
          "rail": "acats",
          "amount": 175000,
          "occurred_at": "2026-04-12T14:05:00.000Z"
        },
        {
          "transaction_id": "tx_book_7",
          "source_system": "merrill_books",
          "rail": "account",
          "amount": 0,
          "occurred_at": "2026-04-02T09:00:00.000Z"
        },
        {
          "transaction_id": "tx_digital_7",
          "source_system": "merrill_digital",
          "rail": "digital",
          "amount": 3,
          "occurred_at": "2026-04-20T18:30:00.000Z"
        }
      ],
      "policies": [
        {
          "policy_id": "consent",
          "verdict": "clear"
        },
        {
          "policy_id": "eligibility",
          "verdict": "clear"
        },
        {
          "policy_id": "vulnerability",
          "verdict": "clear"
        }
      ]
    },
    {
      "household_token": "tok_demo_merrill_0008",
      "exposed": true,
      "records": [
        {
          "transaction_id": "tx_acats_8",
          "source_system": "merrill_transfer_workflow",
          "rail": "acats",
          "amount": 200000,
          "occurred_at": "2026-04-12T14:05:00.000Z"
        },
        {
          "transaction_id": "tx_book_8",
          "source_system": "merrill_books",
          "rail": "account",
          "amount": 0,
          "occurred_at": "2026-04-02T09:00:00.000Z"
        },
        {
          "transaction_id": "tx_digital_8",
          "source_system": "merrill_digital",
          "rail": "digital",
          "amount": 3,
          "occurred_at": "2026-04-20T18:30:00.000Z"
        }
      ],
      "policies": [
        {
          "policy_id": "consent",
          "verdict": "clear"
        },
        {
          "policy_id": "eligibility",
          "verdict": "clear"
        },
        {
          "policy_id": "vulnerability",
          "verdict": "clear"
        }
      ]
    },
    {
      "household_token": "tok_demo_merrill_0009",
      "exposed": true,
      "records": [
        {
          "transaction_id": "tx_acats_9",
          "source_system": "merrill_transfer_workflow",
          "rail": "acats",
          "amount": 225000,
          "occurred_at": "2026-04-12T14:05:00.000Z"
        },
        {
          "transaction_id": "tx_book_9",
          "source_system": "merrill_books",
          "rail": "account",
          "amount": 0,
          "occurred_at": "2026-04-02T09:00:00.000Z"
        }
      ],
      "policies": [
        {
          "policy_id": "consent",
          "verdict": "clear"
        },
        {
          "policy_id": "eligibility",
          "verdict": "clear"
        },
        {
          "policy_id": "vulnerability",
          "verdict": "clear"
        }
      ]
    },
    {
      "household_token": "tok_demo_merrill_0010",
      "exposed": true,
      "records": [
        {